<config
    xmlns:xsi='http://www.w3.org/2001/XMLSchema-instance'
    xmlns='http://www.ehcache.org/v3'
    xmlns:jsr107='http://www.ehcache.org/v3/jsr107'
    xsi:schemaLocation="http://www.ehcache.org/v3 ../../../../xml/src/main/resources/ehcache-core.xsd
                        http://www.ehcache.org/v3/jsr107 ../../main/resources/ehcache-107ext.xsd">

  <service>
    <jsr107:defaults>
      <jsr107:cache name="heap" template="heapCache"/>
      <jsr107:cache name="offheap" template="offheapCache"/>
      <jsr107:cache name="disk" template="diskCache"/>
    </jsr107:defaults>
  </service>

  <persistence directory="build/ehcache-107-stats"/>
  
  <cache-template name="diskCache">
    <resources>
      <heap unit="entries">10</heap>
      <disk unit="MB">10</disk>
    </resources>
  </cache-template>
  
  <cache-template name="offheapCache">
    <resources>
      <heap unit="entries">10</heap>
      <offheap unit="MB">10</offheap>
    </resources>
  </cache-template>

  <cache-template name="heapCache">
    <key-type>java.lang.String</key-type>
    <value-type>java.lang.String</value-type>
    <heap unit="entries">10</heap>
  </cache-template>

</config>