<!--
  ~ Copyright Terracotta, Inc.
  ~
  ~ Licensed under the Apache License, Version 2.0 (the "License");
  ~ you may not use this file except in compliance with the License.
  ~ You may obtain a copy of the License at
  ~
  ~     http://www.apache.org/licenses/LICENSE-2.0
  ~
  ~ Unless required by applicable law or agreed to in writing, software
  ~ distributed under the License is distributed on an "AS IS" BASIS,
  ~ WITHOUT WARRANTIES OR CONDITIONS OF ANY KIND, either express or implied.
  ~ See the License for the specific language governing permissions and
  ~ limitations under the License.
  -->

<config
  xmlns:xsi='http://www.w3.org/2001/XMLSchema-instance'
  xmlns='http://www.ehcache.org/v3'
  xsi:schemaLocation="http://www.ehcache.org/v3 ../../../main/resources/ehcache-core.xsd">

  <persistence directory="some/dir"/>
  <disk-store thread-pool="pool-disk"/>

  <cache alias="test">
    <key-type>java.lang.String</key-type>
    <value-type>java.lang.String</value-type>
    <resources>
      <heap unit="MB">100</heap>
      <disk unit="GB" persistent="true">100</disk>
    </resources>
    <disk-store-settings thread-pool="pool-disk" writer-concurrency="10" disk-segments="2"/>
  </cache>
</config>
