<!--
  ~ Copyright Terracotta, Inc.
  ~
  ~ Licensed under the Apache License, Version 2.0 (the "License");
  ~ you may not use this file except in compliance with the License.
  ~ You may obtain a copy of the License at
  ~
  ~     http://www.apache.org/licenses/LICENSE-2.0
  ~
  ~ Unless required by applicable law or agreed to in writing, software
  ~ distributed under the License is distributed on an "AS IS" BASIS,
  ~ WITHOUT WARRANTIES OR CONDITIONS OF ANY KIND, either express or implied.
  ~ See the License for the specific language governing permissions and
  ~ limitations under the License.
  -->

<config
    xmlns:xsi='http://www.w3.org/2001/XMLSchema-instance'
    xmlns='http://www.ehcache.org/v3'
    xmlns:jsr107='http://www.ehcache.org/v3/jsr107'
    xsi:schemaLocation="http://www.ehcache.org/v3 ../../../../../../../xml/src/main/resources/ehcache-core.xsd
                        http://www.ehcache.org/v3/jsr107 ../../../../../../../107/src/main/resources/ehcache-107-ext.xsd">
  <service>
    <jsr107:defaults default-template="tinyCache">
      <jsr107:cache name="foos" template="stringCache"/>
    </jsr107:defaults>
  </service>

  <cache alias="personCache">
    <key-type>java.lang.Long</key-type>
    <value-type>org.ehcache.osgi.Person</value-type>
    <heap>10</heap>
  </cache>

  <cache-template name="stringCache">
    <key-type>java.lang.String</key-type>
    <value-type>Person</value-type>
    <heap unit="entries">2000</heap>
  </cache-template>
  <cache-template name="tinyCache">
    <heap unit="entries">20</heap>
  </cache-template>
</config>
