<!--
  ~ Copyright Terracotta, Inc.
  ~
  ~ Licensed under the Apache License, Version 2.0 (the "License");
  ~ you may not use this file except in compliance with the License.
  ~ You may obtain a copy of the License at
  ~
  ~     http://www.apache.org/licenses/LICENSE-2.0
  ~
  ~ Unless required by applicable law or agreed to in writing, software
  ~ distributed under the License is distributed on an "AS IS" BASIS,
  ~ WITHOUT WARRANTIES OR CONDITIONS OF ANY KIND, either express or implied.
  ~ See the License for the specific language governing permissions and
  ~ limitations under the License.
  -->

<ehcache:config
    xmlns:xsi='http://www.w3.org/2001/XMLSchema-instance'
    xmlns:ehcache='http://www.ehcache.org/v3'
    xsi:schemaLocation="http://www.ehcache.org/v3 ../../../main/resources/ehcache-core.xsd">

  <ehcache:cache alias="class">
    <ehcache:key-type>java.lang.String</ehcache:key-type>
    <ehcache:value-type>java.lang.String</ehcache:value-type>
    <ehcache:expiry>
      <ehcache:class>com.pany.ehcache.MyExpiry</ehcache:class>
    </ehcache:expiry>
    <ehcache:heap>5</ehcache:heap>
  </ehcache:cache>

  <ehcache:cache alias="deprecatedClass">
    <ehcache:key-type>java.lang.String</ehcache:key-type>
    <ehcache:value-type>java.lang.String</ehcache:value-type>
    <ehcache:expiry>
      <ehcache:class>com.pany.ehcache.DeprecatedExpiry</ehcache:class>
    </ehcache:expiry>
    <ehcache:heap>5</ehcache:heap>
  </ehcache:cache>

  <ehcache:cache alias="none">
    <ehcache:key-type>java.lang.String</ehcache:key-type>
    <ehcache:value-type>java.lang.String</ehcache:value-type>
    <ehcache:expiry>
      <ehcache:none/>
    </ehcache:expiry>
    <ehcache:heap>5</ehcache:heap>
  </ehcache:cache>

  <ehcache:cache alias="tti">
    <ehcache:key-type>java.lang.String</ehcache:key-type>
    <ehcache:value-type>java.lang.String</ehcache:value-type>
    <ehcache:expiry>
      <ehcache:tti unit="millis">500</ehcache:tti>
    </ehcache:expiry>
    <ehcache:heap>5</ehcache:heap>
  </ehcache:cache>

  <ehcache:cache alias="ttl">
    <ehcache:key-type>java.lang.String</ehcache:key-type>
    <ehcache:value-type>java.lang.String</ehcache:value-type>
    <ehcache:expiry>
      <ehcache:ttl>30</ehcache:ttl>
    </ehcache:expiry>
    <ehcache:heap>5</ehcache:heap>
  </ehcache:cache>

  <ehcache:cache alias="notSet">
    <ehcache:key-type>java.lang.String</ehcache:key-type>
    <ehcache:value-type>java.lang.String</ehcache:value-type>
    <ehcache:heap>5</ehcache:heap>
  </ehcache:cache>
</ehcache:config>
