<!--
  ~ Copyright Terracotta, Inc.
  ~
  ~ Licensed under the Apache License, Version 2.0 (the "License");
  ~ you may not use this file except in compliance with the License.
  ~ You may obtain a copy of the License at
  ~
  ~     http://www.apache.org/licenses/LICENSE-2.0
  ~
  ~ Unless required by applicable law or agreed to in writing, software
  ~ distributed under the License is distributed on an "AS IS" BASIS,
  ~ WITHOUT WARRANTIES OR CONDITIONS OF ANY KIND, either express or implied.
  ~ See the License for the specific language governing permissions and
  ~ limitations under the License.
  -->

<ehcache:config xmlns:xsi='http://www.w3.org/2001/XMLSchema-instance'
	xmlns:ehcache='http://www.ehcache.org/v3'
	xsi:schemaLocation="http://www.ehcache.org/v3 ../../../main/resources/ehcache-core.xsd">

	<ehcache:service>
    <ehcache:serializer-default>
      <ehcache:class type="java.lang.Number">com.pany.ehcache.serializer.TestSerializer</ehcache:class>
      <ehcache:class type="java.lang.Number" cache="foo">com.pany.ehcache.serializer.TestSerializer</ehcache:class>
      <ehcache:class type="java.lang.Number" cache="bar">com.pany.ehcache.serializer.TestSerializer</ehcache:class>
      <ehcache:class type="java.lang.String">com.pany.ehcache.serializer.TestSerializer</ehcache:class>
    </ehcache:serializer-default>
	</ehcache:service>

	<ehcache:cache-template name="example">
	</ehcache:cache-template>

	<ehcache:cache alias="foo">
	</ehcache:cache>

	<ehcache:cache alias="bar" usesTemplate="example">
		<ehcache:key-type>java.lang.Number</ehcache:key-type>
	</ehcache:cache>
</ehcache:config>