<!--
  ~ Copyright Terracotta, Inc.
  ~
  ~ Licensed under the Apache License, Version 2.0 (the "License");
  ~ you may not use this file except in compliance with the License.
  ~ You may obtain a copy of the License at
  ~
  ~     http://www.apache.org/licenses/LICENSE-2.0
  ~
  ~ Unless required by applicable law or agreed to in writing, software
  ~ distributed under the License is distributed on an "AS IS" BASIS,
  ~ WITHOUT WARRANTIES OR CONDITIONS OF ANY KIND, either express or implied.
  ~ See the License for the specific language governing permissions and
  ~ limitations under the License.
  -->

<ehcache:config
    xmlns:xsi='http://www.w3.org/2001/XMLSchema-instance'
    xmlns:ehcache='http://www.ehcache.org/v3'
    xsi:schemaLocation="http://www.ehcache.org/v3 ../../../main/resources/ehcache-core.xsd">

  <ehcache:disk-store thread-pool="disk-pool"/>

  <ehcache:cache alias="tiered">
    <ehcache:key-type>java.lang.String</ehcache:key-type>
    <ehcache:value-type>java.lang.String</ehcache:value-type>
    <ehcache:resources>
      <ehcache:heap unit="entries">10</ehcache:heap>
      <ehcache:disk unit="MB">100</ehcache:disk>
    </ehcache:resources>
    <ehcache:disk-store-settings writer-concurrency="2" thread-pool="some-pool" disk-segments="4"/>
  </ehcache:cache>

  <ehcache:cache alias="tieredPersistent">
    <ehcache:key-type>java.lang.String</ehcache:key-type>
    <ehcache:value-type>java.lang.String</ehcache:value-type>
    <ehcache:resources>
      <ehcache:heap unit="entries">10</ehcache:heap>
      <ehcache:disk unit="MB" persistent="true">100</ehcache:disk>
    </ehcache:resources>
  </ehcache:cache>

  <ehcache:cache alias="tieredOffHeap">
    <ehcache:key-type>java.lang.String</ehcache:key-type>
    <ehcache:value-type>java.lang.String</ehcache:value-type>
    <ehcache:resources>
      <ehcache:heap unit="entries">10</ehcache:heap>
      <ehcache:offheap unit="MB">10</ehcache:offheap>
    </ehcache:resources>
  </ehcache:cache>

  <ehcache:cache alias="explicitHeapOnly">
    <ehcache:key-type>java.lang.String</ehcache:key-type>
    <ehcache:value-type>java.lang.String</ehcache:value-type>
    <ehcache:resources>
      <ehcache:heap unit="entries">15</ehcache:heap>
    </ehcache:resources>
  </ehcache:cache>

  <ehcache:cache alias="directHeapOnly">
    <ehcache:key-type>java.lang.String</ehcache:key-type>
    <ehcache:value-type>java.lang.String</ehcache:value-type>
    <ehcache:heap unit="entries">25</ehcache:heap>
  </ehcache:cache>

</ehcache:config>
