<!--
  ~ Copyright Terracotta, Inc.
  ~
  ~ Licensed under the Apache License, Version 2.0 (the "License");
  ~ you may not use this file except in compliance with the License.
  ~ You may obtain a copy of the License at
  ~
  ~     http://www.apache.org/licenses/LICENSE-2.0
  ~
  ~ Unless required by applicable law or agreed to in writing, software
  ~ distributed under the License is distributed on an "AS IS" BASIS,
  ~ WITHOUT WARRANTIES OR CONDITIONS OF ANY KIND, either express or implied.
  ~ See the License for the specific language governing permissions and
  ~ limitations under the License.
  -->

<ehcache:config
    xmlns:xsi='http://www.w3.org/2001/XMLSchema-instance'
    xmlns:ehcache='http://www.ehcache.org/v3'
    xsi:schemaLocation="http://www.ehcache.org/v3 ../../../main/resources/ehcache-core.xsd">

  <ehcache:cache-template name="tieredResourceTemplate">
    <ehcache:key-type>java.lang.String</ehcache:key-type>
    <ehcache:value-type>java.lang.String</ehcache:value-type>
    <ehcache:resources>
      <ehcache:heap size="5"/>
      <ehcache:disk size="50"/>
    </ehcache:resources>
  </ehcache:cache-template>

  <ehcache:cache alias="templatedTieredResource" uses-template="tieredResourceTemplate">
  </ehcache:cache>

  <ehcache:cache-template name="persistentTieredResourceTemplate">
    <ehcache:key-type>java.lang.String</ehcache:key-type>
    <ehcache:value-type>java.lang.String</ehcache:value-type>
    <ehcache:resources>
      <ehcache:heap size="5"/>
      <ehcache:disk size="50" persistent="true"/>
    </ehcache:resources>
  </ehcache:cache-template>

  <ehcache:cache alias="persistentTemplatedTieredResource" uses-template="persistentTieredResourceTemplate">
  </ehcache:cache>

  <ehcache:cache-template name="tieredOffHeapResourceTemplate">
    <ehcache:key-type>java.lang.String</ehcache:key-type>
    <ehcache:value-type>java.lang.String</ehcache:value-type>
    <ehcache:resources>
      <ehcache:heap size="5"/>
      <ehcache:offheap size="50" unit="mb"/>
    </ehcache:resources>
  </ehcache:cache-template>

  <ehcache:cache alias="templatedOffHeapTieredResource" uses-template="tieredOffHeapResourceTemplate">
  </ehcache:cache>

  <ehcache:cache-template name="explicitHeapResourceTemplate">
    <ehcache:key-type>java.lang.String</ehcache:key-type>
    <ehcache:value-type>java.lang.String</ehcache:value-type>
    <ehcache:resources>
      <ehcache:heap size="15"/>
    </ehcache:resources>
  </ehcache:cache-template>

  <ehcache:cache alias="templatedExplicitHeapResource" uses-template="explicitHeapResourceTemplate">
  </ehcache:cache>

  <ehcache:cache-template name="implicitHeapResourceTemplate">
    <ehcache:key-type>java.lang.String</ehcache:key-type>
    <ehcache:value-type>java.lang.String</ehcache:value-type>
  </ehcache:cache-template>

  <ehcache:cache alias="templatedImplicitHeapResource" uses-template="implicitHeapResourceTemplate">
  </ehcache:cache>

</ehcache:config>
